@!@!@STARTMSG 2262:0 @!@!@
TLC2 Version 2.16 of 31 December 2020 (rev: cdddf55)
@!@!@ENDMSG 2262 @!@!@
@!@!@STARTMSG 2187:0 @!@!@
Running breadth-first search Model-Checking with fp 121 and seed -6352019760358706287 with 2 workers on 4 cores with 1182MB heap and 2657MB offheap memory [pid: 2639289] (Linux 5.4.0-89-generic amd64, AdoptOpenJDK 14.0.1 x86_64, OffHeapDiskFPSet, DiskStateQueue).
@!@!@ENDMSG 2187 @!@!@
@!@!@STARTMSG 2220:0 @!@!@
Starting SANY...
@!@!@ENDMSG 2220 @!@!@
Parsing file /home/ahamoir/2A/TLA/TLA-TP3/philosophes1.toolbox/Model_3/MC.tla
Parsing file /home/ahamoir/2A/TLA/TLA-TP3/philosophes1.toolbox/Model_3/philosophes1.tla
Parsing file /mnt/n7fs/tla/toolbox-1.7.2/plugins/org.lamport.tlatools_1.0.0.202012311918/tla2sany/StandardModules/TLC.tla
Parsing file /mnt/n7fs/tla/toolbox-1.7.2/plugins/org.lamport.tlatools_1.0.0.202012311918/tla2sany/StandardModules/Naturals.tla
Parsing file /mnt/n7fs/tla/toolbox-1.7.2/plugins/org.lamport.tlatools_1.0.0.202012311918/tla2sany/StandardModules/Sequences.tla
Parsing file /mnt/n7fs/tla/toolbox-1.7.2/plugins/org.lamport.tlatools_1.0.0.202012311918/tla2sany/StandardModules/FiniteSets.tla
Semantic processing of module Naturals
Semantic processing of module philosophes1
Semantic processing of module Sequences
Semantic processing of module FiniteSets
Semantic processing of module TLC
Semantic processing of module MC
@!@!@STARTMSG 2219:0 @!@!@
SANY finished.
@!@!@ENDMSG 2219 @!@!@
@!@!@STARTMSG 2185:0 @!@!@
Starting... (2023-03-22 11:25:08)
@!@!@ENDMSG 2185 @!@!@
@!@!@STARTMSG 2212:0 @!@!@
Implied-temporal checking--satisfiability problem has 5 branches.
@!@!@ENDMSG 2212 @!@!@
@!@!@STARTMSG 2189:0 @!@!@
Computing initial states...
@!@!@ENDMSG 2189 @!@!@
@!@!@STARTMSG 2190:0 @!@!@
Finished computing initial states: 1 distinct state generated at 2023-03-22 11:25:09.
@!@!@ENDMSG 2190 @!@!@
@!@!@STARTMSG 2200:0 @!@!@
Progress(11) at 2023-03-22 11:25:10: 779 states generated, 244 distinct states found, 0 states left on queue.
@!@!@ENDMSG 2200 @!@!@
@!@!@STARTMSG 2192:0 @!@!@
Checking 5 branches of temporal properties for the complete state space with 1220 total distinct states at (2023-03-22 11:25:10)
@!@!@ENDMSG 2192 @!@!@
@!@!@STARTMSG 2267:0 @!@!@
Finished checking temporal properties in 34s at 2023-03-22 11:25:44
@!@!@ENDMSG 2267 @!@!@
@!@!@STARTMSG 2193:0 @!@!@
Model checking completed. No error has been found.
  Estimates of the probability that TLC did not check all reachable states
  because two distinct states had the same fingerprint:
  calculated (optimistic):  val = 7.1E-15
@!@!@ENDMSG 2193 @!@!@
@!@!@STARTMSG 2201:0 @!@!@
The coverage statistics at 2023-03-22 11:25:44
@!@!@ENDMSG 2201 @!@!@
@!@!@STARTMSG 2773:0 @!@!@
<Init line 41, col 1 to line 41, col 4 of module philosophes1>: 1:1
@!@!@ENDMSG 2773 @!@!@
@!@!@STARTMSG 2221:0 @!@!@
  line 42, col 5 to line 43, col 56 of module philosophes1: 1
@!@!@ENDMSG 2221 @!@!@
@!@!@STARTMSG 2772:0 @!@!@
<demande line 45, col 1 to line 45, col 10 of module philosophes1>: 104:344
@!@!@ENDMSG 2772 @!@!@
@!@!@STARTMSG 2221:0 @!@!@
  line 46, col 8 to line 46, col 25 of module philosophes1: 1400
@!@!@ENDMSG 2221 @!@!@
@!@!@STARTMSG 2221:0 @!@!@
  |line 46, col 8 to line 46, col 14 of module philosophes1: 1056
@!@!@ENDMSG 2221 @!@!@
@!@!@STARTMSG 2221:0 @!@!@
  |line 46, col 18 to line 46, col 25 of module philosophes1: 1056
@!@!@ENDMSG 2221 @!@!@
@!@!@STARTMSG 2221:0 @!@!@
  line 47, col 8 to line 47, col 44 of module philosophes1: 344
@!@!@ENDMSG 2221 @!@!@
@!@!@STARTMSG 2221:0 @!@!@
  line 48, col 8 to line 48, col 32 of module philosophes1: 344
@!@!@ENDMSG 2221 @!@!@
@!@!@STARTMSG 2772:0 @!@!@
<priseG line 50, col 1 to line 50, col 9 of module philosophes1>: 68:187
@!@!@ENDMSG 2772 @!@!@
@!@!@STARTMSG 2221:0 @!@!@
  line 51, col 8 to line 51, col 23 of module philosophes1: 1243
@!@!@ENDMSG 2221 @!@!@
@!@!@STARTMSG 2221:0 @!@!@
  |line 51, col 8 to line 51, col 14 of module philosophes1: 1056
@!@!@ENDMSG 2221 @!@!@
@!@!@STARTMSG 2221:0 @!@!@
  |line 51, col 18 to line 51, col 23 of module philosophes1: 1056
@!@!@ENDMSG 2221 @!@!@
@!@!@STARTMSG 2221:0 @!@!@
  line 52, col 8 to line 52, col 37 of module philosophes1: 797
@!@!@ENDMSG 2221 @!@!@
@!@!@STARTMSG 2221:0 @!@!@
  |line 52, col 8 to line 52, col 29 of module philosophes1: 610
@!@!@ENDMSG 2221 @!@!@
@!@!@STARTMSG 2221:0 @!@!@
  |line 52, col 33 to line 52, col 37 of module philosophes1: 610
@!@!@ENDMSG 2221 @!@!@
@!@!@STARTMSG 2221:0 @!@!@
  line 53, col 11 to line 53, col 21 of module philosophes1: 273
@!@!@ENDMSG 2221 @!@!@
@!@!@STARTMSG 2221:0 @!@!@
  |line 53, col 11 to line 53, col 11 of module philosophes1: 247
@!@!@ENDMSG 2221 @!@!@
@!@!@STARTMSG 2221:0 @!@!@
  |line 53, col 15 to line 53, col 21 of module philosophes1: 247
@!@!@ENDMSG 2221 @!@!@
@!@!@STARTMSG 2221:0 @!@!@
  line 53, col 26 to line 53, col 51 of module philosophes1: 112
@!@!@ENDMSG 2221 @!@!@
@!@!@STARTMSG 2221:0 @!@!@
  |line 53, col 26 to line 53, col 47 of module philosophes1: 86
@!@!@ENDMSG 2221 @!@!@
@!@!@STARTMSG 2221:0 @!@!@
  |line 53, col 51 to line 53, col 51 of module philosophes1: 86
@!@!@ENDMSG 2221 @!@!@
@!@!@STARTMSG 2221:0 @!@!@
  line 54, col 11 to line 54, col 21 of module philosophes1: 408
@!@!@ENDMSG 2221 @!@!@
@!@!@STARTMSG 2221:0 @!@!@
  |line 54, col 11 to line 54, col 11 of module philosophes1: 247
@!@!@ENDMSG 2221 @!@!@
@!@!@STARTMSG 2221:0 @!@!@
  |line 54, col 15 to line 54, col 21 of module philosophes1: 247
@!@!@ENDMSG 2221 @!@!@
@!@!@STARTMSG 2221:0 @!@!@
  line 55, col 8 to line 55, col 63 of module philosophes1: 187
@!@!@ENDMSG 2221 @!@!@
@!@!@STARTMSG 2221:0 @!@!@
  line 56, col 8 to line 56, col 21 of module philosophes1: 187
@!@!@ENDMSG 2221 @!@!@
@!@!@STARTMSG 2772:0 @!@!@
<priseD line 58, col 1 to line 58, col 9 of module philosophes1>: 35:123
@!@!@ENDMSG 2772 @!@!@
@!@!@STARTMSG 2221:0 @!@!@
  line 59, col 8 to line 59, col 37 of module philosophes1: 1179
@!@!@ENDMSG 2221 @!@!@
@!@!@STARTMSG 2221:0 @!@!@
  |line 59, col 8 to line 59, col 29 of module philosophes1: 1056
@!@!@ENDMSG 2221 @!@!@
@!@!@STARTMSG 2221:0 @!@!@
  |line 59, col 33 to line 59, col 37 of module philosophes1: 1056
@!@!@ENDMSG 2221 @!@!@
@!@!@STARTMSG 2221:0 @!@!@
  line 60, col 11 to line 60, col 21 of module philosophes1: 523
@!@!@ENDMSG 2221 @!@!@
@!@!@STARTMSG 2221:0 @!@!@
  |line 60, col 11 to line 60, col 11 of module philosophes1: 476
@!@!@ENDMSG 2221 @!@!@
@!@!@STARTMSG 2221:0 @!@!@
  |line 60, col 15 to line 60, col 21 of module philosophes1: 476
@!@!@ENDMSG 2221 @!@!@
@!@!@STARTMSG 2221:0 @!@!@
  line 61, col 11 to line 61, col 21 of module philosophes1: 552
@!@!@ENDMSG 2221 @!@!@
@!@!@STARTMSG 2221:0 @!@!@
  |line 61, col 11 to line 61, col 11 of module philosophes1: 476
@!@!@ENDMSG 2221 @!@!@
@!@!@STARTMSG 2221:0 @!@!@
  |line 61, col 15 to line 61, col 21 of module philosophes1: 476
@!@!@ENDMSG 2221 @!@!@
@!@!@STARTMSG 2221:0 @!@!@
  line 61, col 26 to line 61, col 51 of module philosophes1: 456
@!@!@ENDMSG 2221 @!@!@
@!@!@STARTMSG 2221:0 @!@!@
  |line 61, col 26 to line 61, col 47 of module philosophes1: 380
@!@!@ENDMSG 2221 @!@!@
@!@!@STARTMSG 2221:0 @!@!@
  |line 61, col 51 to line 61, col 51 of module philosophes1: 380
@!@!@ENDMSG 2221 @!@!@
@!@!@STARTMSG 2221:0 @!@!@
  line 62, col 8 to line 62, col 23 of module philosophes1: 295
@!@!@ENDMSG 2221 @!@!@
@!@!@STARTMSG 2221:0 @!@!@
  |line 62, col 8 to line 62, col 14 of module philosophes1: 172
@!@!@ENDMSG 2221 @!@!@
@!@!@STARTMSG 2221:0 @!@!@
  |line 62, col 18 to line 62, col 23 of module philosophes1: 172
@!@!@ENDMSG 2221 @!@!@
@!@!@STARTMSG 2221:0 @!@!@
  line 63, col 8 to line 63, col 63 of module philosophes1: 123
@!@!@ENDMSG 2221 @!@!@
@!@!@STARTMSG 2221:0 @!@!@
  line 64, col 8 to line 64, col 21 of module philosophes1: 123
@!@!@ENDMSG 2221 @!@!@
@!@!@STARTMSG 2772:0 @!@!@
<mange line 66, col 1 to line 66, col 8 of module philosophes1>: 36:102
@!@!@ENDMSG 2772 @!@!@
@!@!@STARTMSG 2221:0 @!@!@
  line 67, col 8 to line 67, col 23 of module philosophes1: 1158
@!@!@ENDMSG 2221 @!@!@
@!@!@STARTMSG 2221:0 @!@!@
  |line 67, col 8 to line 67, col 14 of module philosophes1: 1056
@!@!@ENDMSG 2221 @!@!@
@!@!@STARTMSG 2221:0 @!@!@
  |line 67, col 18 to line 67, col 23 of module philosophes1: 1056
@!@!@ENDMSG 2221 @!@!@
@!@!@STARTMSG 2221:0 @!@!@
  line 68, col 8 to line 68, col 33 of module philosophes1: 712
@!@!@ENDMSG 2221 @!@!@
@!@!@STARTMSG 2221:0 @!@!@
  |line 68, col 8 to line 68, col 29 of module philosophes1: 610
@!@!@ENDMSG 2221 @!@!@
@!@!@STARTMSG 2221:0 @!@!@
  |line 68, col 33 to line 68, col 33 of module philosophes1: 610
@!@!@ENDMSG 2221 @!@!@
@!@!@STARTMSG 2221:0 @!@!@
  line 69, col 8 to line 69, col 33 of module philosophes1: 242
@!@!@ENDMSG 2221 @!@!@
@!@!@STARTMSG 2221:0 @!@!@
  |line 69, col 8 to line 69, col 29 of module philosophes1: 140
@!@!@ENDMSG 2221 @!@!@
@!@!@STARTMSG 2221:0 @!@!@
  |line 69, col 33 to line 69, col 33 of module philosophes1: 140
@!@!@ENDMSG 2221 @!@!@
@!@!@STARTMSG 2221:0 @!@!@
  line 70, col 8 to line 70, col 44 of module philosophes1: 102
@!@!@ENDMSG 2221 @!@!@
@!@!@STARTMSG 2221:0 @!@!@
  line 71, col 8 to line 71, col 32 of module philosophes1: 102
@!@!@ENDMSG 2221 @!@!@
@!@!@STARTMSG 2772:0 @!@!@
<pense line 73, col 1 to line 73, col 8 of module philosophes1>: 0:102
@!@!@ENDMSG 2772 @!@!@
@!@!@STARTMSG 2221:0 @!@!@
  line 74, col 8 to line 74, col 23 of module philosophes1: 1158
@!@!@ENDMSG 2221 @!@!@
@!@!@STARTMSG 2221:0 @!@!@
  |line 74, col 8 to line 74, col 14 of module philosophes1: 1056
@!@!@ENDMSG 2221 @!@!@
@!@!@STARTMSG 2221:0 @!@!@
  |line 74, col 18 to line 74, col 23 of module philosophes1: 1056
@!@!@ENDMSG 2221 @!@!@
@!@!@STARTMSG 2221:0 @!@!@
  line 75, col 8 to line 75, col 46 of module philosophes1: 102
@!@!@ENDMSG 2221 @!@!@
@!@!@STARTMSG 2221:0 @!@!@
  line 76, col 8 to line 76, col 87 of module philosophes1: 102
@!@!@ENDMSG 2221 @!@!@
@!@!@STARTMSG 2774:0 @!@!@
<Action line 35, col 16 to line 35, col 108 of module philosophes1>
@!@!@ENDMSG 2774 @!@!@
@!@!@STARTMSG 2221:0 @!@!@
  line 35, col 16 to line 35, col 108 of module philosophes1: 244
@!@!@ENDMSG 2221 @!@!@
@!@!@STARTMSG 2221:0 @!@!@
  |line 35, col 33 to line 35, col 108 of module philosophes1: 976
@!@!@ENDMSG 2221 @!@!@
@!@!@STARTMSG 2221:0 @!@!@
  ||line 35, col 33 to line 35, col 48 of module philosophes1: 976
@!@!@ENDMSG 2221 @!@!@
@!@!@STARTMSG 2221:0 @!@!@
  ||line 35, col 53 to line 35, col 108 of module philosophes1: 102
@!@!@ENDMSG 2221 @!@!@
@!@!@STARTMSG 2221:0 @!@!@
  |line 35, col 25 to line 35, col 30 of module philosophes1: 244
@!@!@ENDMSG 2221 @!@!@
@!@!@STARTMSG 2774:0 @!@!@
<Action line 36, col 16 to line 36, col 110 of module philosophes1>
@!@!@ENDMSG 2774 @!@!@
@!@!@STARTMSG 2221:0 @!@!@
  line 36, col 16 to line 36, col 110 of module philosophes1: 244
@!@!@ENDMSG 2221 @!@!@
@!@!@STARTMSG 2221:0 @!@!@
  |line 36, col 33 to line 36, col 110 of module philosophes1: 976
@!@!@ENDMSG 2221 @!@!@
@!@!@STARTMSG 2221:0 @!@!@
  ||line 36, col 33 to line 36, col 50 of module philosophes1: 976
@!@!@ENDMSG 2221 @!@!@
@!@!@STARTMSG 2221:0 @!@!@
  ||line 36, col 55 to line 36, col 110 of module philosophes1: 300
@!@!@ENDMSG 2221 @!@!@
@!@!@STARTMSG 2221:0 @!@!@
  |line 36, col 25 to line 36, col 30 of module philosophes1: 244
@!@!@ENDMSG 2221 @!@!@
@!@!@STARTMSG 2774:0 @!@!@
<Action line 30, col 21 to line 30, col 112 of module philosophes1>
@!@!@ENDMSG 2774 @!@!@
@!@!@STARTMSG 2221:0 @!@!@
  line 30, col 21 to line 30, col 112 of module philosophes1: 244
@!@!@ENDMSG 2221 @!@!@
@!@!@STARTMSG 2774:0 @!@!@
<Action line 33, col 18 to line 33, col 110 of module philosophes1>
@!@!@ENDMSG 2774 @!@!@
@!@!@STARTMSG 2221:0 @!@!@
  line 33, col 18 to line 33, col 110 of module philosophes1: 244
@!@!@ENDMSG 2221 @!@!@
@!@!@STARTMSG 2221:0 @!@!@
  |line 33, col 35 to line 33, col 110 of module philosophes1: 976
@!@!@ENDMSG 2221 @!@!@
@!@!@STARTMSG 2221:0 @!@!@
  ||line 33, col 36 to line 33, col 51 of module philosophes1: 976
@!@!@ENDMSG 2221 @!@!@
@!@!@STARTMSG 2221:0 @!@!@
  ||line 33, col 58 to line 33, col 109 of module philosophes1: 102
@!@!@ENDMSG 2221 @!@!@
@!@!@STARTMSG 2221:0 @!@!@
  |line 33, col 27 to line 33, col 32 of module philosophes1: 244
@!@!@ENDMSG 2221 @!@!@
@!@!@STARTMSG 2774:0 @!@!@
<Action line 37, col 19 to line 37, col 107 of module philosophes1>
@!@!@ENDMSG 2774 @!@!@
@!@!@STARTMSG 2221:0 @!@!@
  line 37, col 19 to line 37, col 107 of module philosophes1: 244
@!@!@ENDMSG 2221 @!@!@
@!@!@STARTMSG 2221:0 @!@!@
  |line 37, col 36 to line 37, col 107 of module philosophes1: 976
@!@!@ENDMSG 2221 @!@!@
@!@!@STARTMSG 2221:0 @!@!@
  ||line 37, col 58 to line 37, col 107 of module philosophes1: 3904
@!@!@ENDMSG 2221 @!@!@
@!@!@STARTMSG 2221:0 @!@!@
  |||line 37, col 58 to line 37, col 79 of module philosophes1: 3904
@!@!@ENDMSG 2221 @!@!@
@!@!@STARTMSG 2221:0 @!@!@
  |||line 37, col 85 to line 37, col 106 of module philosophes1: 580
@!@!@ENDMSG 2221 @!@!@
@!@!@STARTMSG 2221:0 @!@!@
  ||||line 37, col 85 to line 37, col 93 of module philosophes1: 580
@!@!@ENDMSG 2221 @!@!@
@!@!@STARTMSG 2221:0 @!@!@
  ||||line 37, col 98 to line 37, col 106 of module philosophes1: 242
@!@!@ENDMSG 2221 @!@!@
@!@!@STARTMSG 2221:0 @!@!@
  ||line 37, col 45 to line 37, col 55 of module philosophes1: 976
@!@!@ENDMSG 2221 @!@!@
@!@!@STARTMSG 2221:0 @!@!@
  |line 37, col 28 to line 37, col 33 of module philosophes1: 244
@!@!@ENDMSG 2221 @!@!@
@!@!@STARTMSG 2202:0 @!@!@
End of statistics.
@!@!@ENDMSG 2202 @!@!@
@!@!@STARTMSG 2200:0 @!@!@
Progress(11) at 2023-03-22 11:25:44: 779 states generated (1 308 s/min), 244 distinct states found (409 ds/min), 0 states left on queue.
@!@!@ENDMSG 2200 @!@!@
@!@!@STARTMSG 2199:0 @!@!@
779 states generated, 244 distinct states found, 0 states left on queue.
@!@!@ENDMSG 2199 @!@!@
@!@!@STARTMSG 2194:0 @!@!@
The depth of the complete state graph search is 11.
@!@!@ENDMSG 2194 @!@!@
@!@!@STARTMSG 2268:0 @!@!@
The average outdegree of the complete state graph is 1 (minimum is 0, the maximum 4 and the 95th percentile is 3).
@!@!@ENDMSG 2268 @!@!@
@!@!@STARTMSG 2186:0 @!@!@
Finished in 35767ms at (2023-03-22 11:25:44)
@!@!@ENDMSG 2186 @!@!@
